129,847640,https://www.airbnb.com/rooms/847640,20250525024250,2025-05-25,city scrape,Pleasant apartment with a terrace on the Danube.,"The apartment is located directly on the banks of the Danube, near the Margaret Bridge. This is a sunny, friendly, well-situated and well-equipped apartment in a very nice building, from the sunny terrace with a nice view of the park, the Danube, the Margaret island and the Buda mountains.<br />This is a real romantic nest at the greatest part of the city! Just imagine taking breakfast out on the terrace, you breathe a fresh air, enjoy the great view , you can really feel perfectly happy here!","The apartment is situated in the heart of Budapest, right on the banks of the Danube near Margaret bridge. It is sunny, welcoming, and well locate. There is a view over the Danube, the enchanting Margaret Island and the Buda hills.<br />It is a quiet, safe, central part of the city and it is one of the most popular and most atmospheric areas of Budapest.",https://a0.muscache.com/pictures/12553746/46f05e2e_original.jpg,4425704,https://www.airbnb.com/users/show/4425704,Tamas,2012-12-17,"Budapest, Hungary","Budapesten élek. Vendéglátással, turizmussal és bormarketinggel foglalkozom. Szeretek sokat utazni belföldön, szeretem megkóstolni a helyi ételeket és a jó gazdák jó borait, hogy aztán mesélhessek az élményről és ajánlhassam a helyeket ismerőseimnek és vendégeimnek.",within an hour,100%,99%,t,https://a0.muscache.com/im/users/4425704/profile_pic/1358671344/original.jpg?aki_policy=profile_small,https://a0.muscache.com/im/users/4425704/profile_pic/1358671344/original.jpg?aki_policy=profile_x_medium,District XIII.,5,6,"['email', 'phone']",t,t,"Budapest, Hungary",XIII. kerület,,47.51905,19.05135,Entire condo,Entire home/apt,3,1.0,1 bath,1.0,2.0,"[""Laundromat nearby"", ""Paid parking off premises"", ""Carbon monoxide alarm"", ""Hot water kettle"", ""Toaster"", ""Hair dryer"", ""Paid resort access"", ""Microwave"", ""Crib"", ""Private patio or balcony"", ""Cleaning products"", ""Coffee maker"", ""Elevator"", ""Wifi"", ""Host greets you"", ""Beach view"", ""Hot water"", ""Wine glasses"", ""First aid kit"", ""Outdoor furniture"", ""Free washer \u2013 In unit"", ""Central heating"", ""Refrigerator"", ""Private entrance"", ""Dining table"", ""Mountain view"", ""Dedicated workspace"", ""Pack \u2019n play/Travel crib - available upon request"", ""Iron"", ""Clothing storage: wardrobe"", ""Bathtub"", ""Extra pillows and blankets"", ""Safe"", ""Paid parking on premises"", ""Cleaning available during stay"", ""Smoke alarm"", ""Free street parking"", ""Hangers"", ""Room-darkening shades"", ""Dishes and silverware"", ""Drying rack for clothing"", ""Park view"", ""Kitchen"", ""Coffee"", ""Cooking basics"", ""Mini fridge"", ""TV with standard cable"", ""Waterfront"", ""Books and reading material"", ""Portable fans"", ""Siemens stainless steel electric stove"", ""Essentials"", ""Luggage dropoff allowed"", ""Long term stays allowed"", ""Bed linens"", ""River view""]","$15,371.00",3,1125,1,3,1125,1125,3.0,1125.0,,t,3,8,12,181,2025-05-25,143,13,1,68,13,78,1198938.0,2013-06-02,2025-05-07,4.58,4.73,4.51,4.82,4.87,4.8,4.71,MA19017204,f,3,3,0,0,0.98
130,847643,https://www.airbnb.com/rooms/847643,20250525024250,2025-05-25,city scrape,Lovely nest apartment at Vaci utca!,"Nice apartment in the pedestrian area of Budapest, at Vaci Street! It is simply impossible to find an apartment for rent with a better location in Budapest. Affordable excellent accommodation for lovely couples, honeymooners, friends, businessmen and even for single adventurers also.","The apartment is located in the heart of the city, at the famous pedestrian street. There is simply everything!<br />This is the most prestigious area of Budapest, with high services in every sense. Near the building there is a non-stop supermarket, boutiques, travel agencies, Tourinform office, etc. are found. Walk just 50-100 meters and you have arrived at one of the most beautiful squares in Budapest, Vorosmarty Square, where you can taste and eat the best pastries and coffee specialties of the world-famous Gerbau Cafe, and take a pleasant walk up and down. on the famous Váci Street. The Danube river and the Dunacorso promenade are also very close, it only takes a few minutes to get there from the apartment. You can also reach the Opera House with an easy walk. If you turn in the opposite direction, just a few hundred meters from the apartment you will reach the center of the ""nightlife and music life"", where there are many entertainment venues, such as music clubs, jazz cellars, pu",https://a0.muscache.com/pictures/miso/Hosting-847643/original/27b11548-f11c-496e-bf2e-47e418e99bc2.jpeg,4425704,https://www.airbnb.com/users/show/4425704,Tamas,2012-12-17,"Budapest, Hungary","Budapesten élek. Vendéglátással, turizmussal és bormarketinggel foglalkozom. Szeretek sokat utazni belföldön, szeretem megkóstolni a helyi ételeket és a jó gazdák jó borait, hogy aztán mesélhessek az élményről és ajánlhassam a helyeket ismerőseimnek és vendégeimnek.",within an hour,100%,99%,t,https://a0.muscache.com/im/users/4425704/profile_pic/1358671344/original.jpg?aki_policy=profile_small,https://a0.muscache.com/im/users/4425704/profile_pic/1358671344/original.jpg?aki_policy=profile_x_medium,District XIII.,5,6,"['email', 'phone']",t,t,"Budapest, Hungary",V. kerület,,47.49692,19.05313,Entire condo,Entire home/apt,3,1.0,1 bath,1.0,4.0,"[""Backyard"", ""Paid parking off premises"", ""Carbon monoxide alarm"", ""Hot water kettle"", ""Toaster"", ""Oven"", ""Hair dryer"", ""Microwave"", ""Courtyard view"", ""Heating"", ""Coffee maker"", ""Elevator"", ""Wifi"", ""Host greets you"", ""Hot water"", ""Wine glasses"", ""Clothing storage"", ""Refrigerator"", ""Private entrance"", ""Dining table"", ""Pets allowed"", ""Iron"", ""Freezer"", ""Bathtub"", ""Extra pillows and blankets"", ""Paid parking on premises"", ""Stove"", ""Window guards"", ""Cleaning available during stay"", ""Hangers"", ""Room-darkening shades"", ""Dishes and silverware"", ""Baking sheet"", ""Drying rack for clothing"", ""Kitchen"", ""Coffee"", ""Cooking basics"", ""Mini fridge"", ""TV with standard cable"", ""Portable fans"", ""Essentials"", ""Long term stays allowed"", ""Bed linens""]","$13,935.00",3,1125,2,4,1125,1125,3.0,1125.0,,t,10,31,39,261,2025-05-25,307,43,4,122,42,255,3553425.0,2013-04-12,2025-05-18,4.5,4.72,4.3,4.72,4.73,4.98,4.68,MA19021872,f,3,3,0,0,2.08
131,847668,https://www.airbnb.com/rooms/847668,20250525024250,2025-05-25,city scrape,Budapest Downtown - What else?,"Renovated and furnished apartment located in prime location on a pedestrian street in the very center of Budapest. In an elegant, well kept house, the windows look to an inner courtyard, providing a secluded atmosphere. <br />CHECK FOR LAST MINUTE PRICES!",,https://a0.muscache.com/pictures/12086172/286af21a_original.jpg,4334000,https://www.airbnb.com/users/show/4334000,Judit,2012-12-05,"Luzern, Switzerland","Komme aus Luzern, bin 42 jahre alt und Produzentin. Habe drei Kinder (11,15 und 16 Jahre) ein Pferd und zwei Hunde. Geboren bin ich in Budapest, lebe aber seit 32 Jahre in der Schweiz. Spreche ungarisch, deutsch, französisch, englisch und italienisch.",within a few hours,100%,76%,t,https://a0.muscache.com/im/users/4334000/profile_pic/1354740999/original.jpg?aki_policy=profile_small,https://a0.muscache.com/im/users/4334000/profile_pic/1354740999/original.jpg?aki_policy=profile_x_medium,Terézváros - District VI.,2,2,"['email', 'phone', 'work_email']",t,t,,VI. kerület,,47.50252,19.05963,Entire rental unit,Entire home/apt,4,1.0,1 bath,1.0,2.0,"[""Paid parking off premises"", ""Hot water kettle"", ""Toaster"", ""Hair dryer"", ""Coffee maker: Nespresso"", ""Microwave"", ""Heating"", ""Elevator"", ""Wifi"", ""Shampoo"", ""Host greets you"", ""Hot water"", ""Wine glasses"", ""Clothing storage"", ""Refrigerator"", ""Dining table"", ""Washer"", ""Dedicated workspace"", ""Iron"", ""Bathtub"", ""Paid parking on premises"", ""Stove"", ""Hangers"", ""Dishes and silverware"", ""Drying rack for clothing"", ""Kitchen"", ""Coffee"", ""TV with standard cable"", ""Portable fans"", ""Essentials"", ""Long term stays allowed"", ""Bed linens""]","$32,084.00",4,1125,4,4,1125,1125,4.0,1125.0,,t,3,10,11,189,2025-05-25,85,17,2,79,18,136,4363424.0,2013-01-03,2025-05-05,4.94,4.96,4.87,4.93,4.96,5.0,4.89,,f,2,2,0,0,0.56
132,872374,https://www.airbnb.com/rooms/872374,20250525024250,2025-05-25,city scrape,"Palazzo  Apt: Style, fire-place and balcony.","Fantastic apartment with stucco, stained-glass windows, gilded wood-paneling, a beautiful onyx fire-place and a pleasant balcony. Very romantic and historic. Enjoy a feel of Budapest at the turn of the century. Metro and tram right in front of the apartment","The neighborhhod is very central and yet has retained its popular character. The tourist areas (Jewish neighborhood with all the bars, Andrássy út etc..) are 10 minutes away. You will enjoy life as the locals do and see a slice of the real Budapest.<br />The apartment is in a superb location , with everything right at your door. Guests particularly love the beautiful market hall, where you can shop for fresh produce. We are surrounded by neighborhood restaurants, cafés and shops. Public transport is in front of the door: metro 4 with direct access to the Gellért baths and the Central Market, Tram 4-6 that goes all along the Grand Boulevard, the 2 other metro lines a few minutes away as well as numerous bus lines",https://a0.muscache.com/pictures/dbe6d214-6be9-4156-bd7d-c073011cd173.jpg,4602793,https://www.airbnb.com/users/show/4602793,Eliane,2013-01-06,"Budapest, Hungary",xxx,within an hour,100%,85%,t,https://a0.muscache.com/im/users/4602793/profile_pic/1369157117/original.jpg?aki_policy=profile_small,https://a0.muscache.com/im/users/4602793/profile_pic/1369157117/original.jpg?aki_policy=profile_x_medium,Józsefváros - District VIII.,4,17,"['email', 'phone']",t,t,"Budapest, Hungary",VIII. kerület,,47.4931,19.07204,Entire rental unit,Entire home/apt,6,1.0,1 bath,2.0,4.0,"[""Shower gel"", ""Patio or balcony"", ""Paid parking off premises"", ""Carbon monoxide alarm"", ""Hot water kettle"", ""Toaster"", ""Oven"", ""Conditioner"", ""Bidet"", ""Hair dryer"", ""Microwave"", ""Crib"", ""Indoor fireplace"", ""Cleaning products"", ""Heating"", ""Body soap"", ""Coffee maker"", ""Elevator"", ""Wifi"", ""Shampoo"", ""Hot water"", ""Wine glasses"", ""First aid kit"", ""Babysitter recommendations"", ""Dishwasher"", ""Self check-in"", ""Refrigerator"", ""Private entrance"", ""Dining table"", ""Washer"", ""Dedicated workspace"", ""Pets allowed"", ""Iron"", ""Bathtub"", ""Extra pillows and blankets"", ""Stove"", ""Cleaning available during stay"", ""Smoke alarm"", ""Hangers"", ""Room-darkening shades"", ""Dishes and silverware"", ""Kitchen"", ""Cooking basics"", ""Portable fans"", ""Essentials"", ""Long term stays allowed"", ""Bed linens"", ""Lockbox""]","$38,981.00",2,365,2,2,365,365,2.0,365.0,,t,5,16,27,96,2025-05-25,93,8,1,96,9,48,1871088.0,2016-01-03,2025-05-04,4.87,4.93,4.9,4.92,4.91,4.87,4.83,MA19016940,f,3,3,0,0,0.81
133,885927,https://www.airbnb.com/rooms/885927,20250525024250,2025-05-25,city scrape,❤️ Romeo and Juliet ❤️ - at Andrássy street,"The fully renovated and stylish one bedroom apartment with exposed brick has a true city feeling! ❤️<br />Walking distance from Andrassy Avenue, Grand Boulevard, City park, Margaret Island, the best thermal bath and easy access to all major famous sights!","District 6 is the cultural centre of Budapest, with a lot of historicals buildings such as Liszt Music Academy or the Opera House. Everything is nearby, so you can walk to most of the famous sights. Andrássy street  (commonly known as the Champs Elysées of Budapest), Széchenyi termal bath, Heroes Square, City Park, Opera House, Museum of Fine Art, Nagymező Utca (the Broadway of the city) can be reached within minutes.<br />The apartment is close to the Andrassy Avenue, what is famous for its neo-renaissance buildings, elegant restaurants and luxury boutiques. Worth to visit the Terror of House located at Andrássy 60. But you can also find cheap buffets, coffee shops, exchange offices, ATM and the Westend Shopping Center is in the neighbourhood.",https://a0.muscache.com/pictures/miso/Hosting-885927/original/b076a1b6-8d56-4a6f-99a7-9251d8d009aa.jpeg,4696670,https://www.airbnb.com/users/show/4696670,Maria,2013-01-14,"Budapest, Hungary","Hi,

My name is Maria. I'm an interior designer, my husband is an architect. We refurbished the flat together. Feel yourself at home in my apartment !


Lakberendező vagyok, a férjem építész. Az apartmant együtt újítottuk fel, remélem, tetszik és élvezni fogod az itt töltött időt. 
Szeretem, hogy új emberekkel ismerkedhetek meg. ",within an hour,100%,100%,t,https://a0.muscache.com/im/users/4696670/profile_pic/1358248047/original.jpg?aki_policy=profile_small,https://a0.muscache.com/im/users/4696670/profile_pic/1358248047/original.jpg?aki_policy=profile_x_medium,Terézváros - District VI.,1,4,"['email', 'phone']",t,t,"Budapest, Hungary",VI. kerület,,47.50993,19.06597,Entire condo,Entire home/apt,2,1.0,1 bath,1.0,1.0,"[""Shower gel"", ""Heating - split type ductless system"", ""Laundromat nearby"", ""Paid parking off premises"", ""Carbon monoxide alarm"", ""Hot water kettle"", ""Toaster"", ""Conditioner"", ""Hair dryer"", ""Microwave"", ""Courtyard view"", ""Coffee maker"", ""Body soap"", ""Wifi"", ""Shampoo"", ""Hot water"", ""Wine glasses"", ""Fire extinguisher"", ""Self check-in"", ""Refrigerator"", ""40 inch HDTV"", ""Dining table"", ""Iron"", ""Clothing storage: wardrobe"", ""Extra pillows and blankets"", ""Paid parking on premises"", ""Cleaning available during stay"", ""Smoke alarm"", ""Hangers"", ""Room-darkening shades"", ""Dishes and silverware"", ""Baking sheet"", ""Kitchen"", ""Cooking basics"", ""Ariston stainless steel oven"", ""Essentials"", ""Long term stays allowed"", ""Teka electric stove"", ""Lockbox"", ""AC - split type ductless system""]","$16,899.00",3,90,1,3,1125,1125,3.0,1125.0,,t,16,46,69,153,2025-05-25,600,47,4,153,41,255,4309245.0,2013-02-02,2025-05-10,4.87,4.87,4.9,4.95,4.96,4.8,4.87,MA19013671,t,1,1,0,0,4.0
134,886095,https://www.airbnb.com/rooms/886095,20250525024250,2025-05-25,city scrape,30 meters from St Stephen Square,"The apartment is located in a historical building, only 30 meters from St. Stephen's Square.<br /><br />The flat is on the ground floor of the building and overlooks the inner courtyard of the building. Therefore there are no stairs going up into the apartment and there is no noise coming in from the street.",,https://a0.muscache.com/pictures/1ebd40c6-371d-4479-b722-43029e106791.jpg,4697608,https://www.airbnb.com/users/show/4697608,Péter,2013-01-14,"Budapest, Hungary","We fell in love with this flat because of its location and also because of its originally ruiny state, we could renovate it without any compromise. Our intention was to make a small jewel box out of it and we did everything just as if it was for myself for long term living.
It is good to make money with your property, but it would not make any fun if we did not see that our guests are happy to stay at our place.",within an hour,100%,100%,f,https://a0.muscache.com/im/users/4697608/profile_pic/1371585796/original.jpg?aki_policy=profile_small,https://a0.muscache.com/im/users/4697608/profile_pic/1371585796/original.jpg?aki_policy=profile_x_medium,Lipótváros,3,3,"['email', 'phone']",t,t,,V. kerület,,47.50124,19.05206,Entire loft,Entire home/apt,4,1.0,1 bath,2.0,2.0,"[""Paid parking off premises"", ""Hair dryer"", ""Air conditioning"", ""Microwave"", ""Crib"", ""Heating"", ""Coffee maker"", ""Elevator"", ""Shampoo"", ""Hot water"", ""Self check-in"", ""Refrigerator"", ""Private entrance"", ""Iron"", ""Stove"", ""Dishes and silverware"", ""Hangers"", ""Kitchen"", ""Cooking basics"", ""TV with standard cable"", ""Essentials"", ""Bed linens"", ""Lockbox"", ""Fast wifi \u2013 149 Mbps""]","$20,968.00",3,25,1,5,1125,1125,3.4,1125.0,,t,0,11,31,117,2025-05-25,935,77,4,115,73,255,5346840.0,2013-02-26,2025-05-07,4.76,4.85,4.7,4.89,4.87,4.97,4.83,,t,3,3,0,0,6.27
135,907433,https://www.airbnb.com/rooms/907433,20250525024250,2025-05-25,city scrape,Bel Appartement Budapest centre,,,https://a0.muscache.com/pictures/23094029/949c39bb_original.jpg,4860623,https://www.airbnb.com/users/show/4860623,Pierre Et Mary,2013-01-27,"Budapest, Hungary","Bonjour,
Nous sommes Pierre et Mary, et seront enchantés de vous accueillir chez nous en plein cœur de Budapest qui est une ville magnifique !",within a few hours,90%,84%,f,https://a0.muscache.com/im/pictures/user/9ab3378d-5070-4ac6-8186-308012f1eb96.jpg?aki_policy=profile_small,https://a0.muscache.com/im/pictures/user/9ab3378d-5070-4ac6-8186-308012f1eb96.jpg?aki_policy=profile_x_medium,Terézváros - District VI.,2,2,"['email', 'phone']",t,t,,VI. kerület,,47.50547,19.06378,Entire rental unit,Entire home/apt,10,1.0,1 bath,3.0,7.0,"[""Shower gel"", ""Standalone high chair - always at the listing"", ""Laundromat nearby"", ""Carbon monoxide alarm"", ""Hot water kettle"", ""Toaster"", ""Hair dryer"", ""Microwave"", ""Courtyard view"", ""Cleaning products"", ""Body soap"", ""Elevator"", ""Children\u2019s books and toys for ages 0-2 years old, 2-5 years old, 5-10 years old, and 10+ years old"", ""Wifi"", ""Shampoo"", ""Hot water"", ""Wine glasses"", ""First aid kit"", ""Children\u2019s dinnerware"", ""Dishwasher"", ""Pack \u2019n play/Travel crib - always at the listing"", ""Free washer \u2013 In unit"", ""Central air conditioning"", ""Central heating"", ""Self check-in"", ""Refrigerator"", ""Private entrance"", ""Dining table"", ""Other stainless steel gas stove"", ""Dedicated workspace"", ""Iron"", ""Paid parking lot on premises"", ""Extra pillows and blankets"", ""Safe"", ""Stainless steel single oven"", ""Coffee maker: drip coffee maker, espresso machine"", ""Cleaning available during stay"", ""Smoke alarm"", ""Paid parking garage off premises"", ""Free street parking"", ""Hangers"", ""Room-darkening shades"", ""Dishes and silverware"", ""Board games"", ""Drying rack for clothing"", ""Baking sheet"", ""Kitchen"", ""Mosquito net"", ""Clothing storage: closet, wardrobe, and dresser"", ""Coffee"", ""Cooking basics"", ""TV with standard cable"", ""Books and reading material"", ""Essentials"", ""Bed linens"", ""Lockbox""]","$39,183.00",1,1125,1,1,1125,1125,1.0,1125.0,,t,7,15,19,134,2025-05-25,206,22,2,131,18,132,5172156.0,2015-01-04,2025-05-04,4.65,4.79,4.68,4.87,4.7,4.86,4.73,,f,2,2,0,0,1.63
136,907584,https://www.airbnb.com/rooms/907584,20250525024250,2025-05-25,city scrape,♥ Estudio enfrente de la Opera!!,"Come and stay on one of the most beautiful, picture & social media friendly street of the city.","ust steps away from the flat you will find:<br /><br />♥ Supermarkets and convenience stores<br />♥ Pharmacy<br />♥ Restaurants<br />♥ Cafes<br />♥ 24/7 Parking lot<br />♥ Money exchange <br />♥ ATM<br /><br />♥ Opera House – Just in from of the flat, it's one of the most beautiful Neo-Renaissance buildings in Europe. Opened in 1884, the Budapest Opera House quickly became one of the most prestigious musical institutions in Europe. You can tour the Opera House during the day, guided tours are offered in several languages.<br /><br />♥ Andrássy Avenue (Ándrassy út)- Recognized as a World Heritage Site. Inaugurated in 1885, its Eclectic Neo-Renaissance palaces were built by the most distinguished architects of the time. In recent years, Andrássy Avenue has become increasingly chic, attracting some of the world's leading designers. Also, many embassies, restaurants and cafés are located along the avenue.<br /><br />♥ Budapest Broadway – Just a few steps from the flat (the intersection of ",https://a0.muscache.com/pictures/28770685/795c2030_original.jpg,4861661,https://www.airbnb.com/users/show/4861661,Carmen & Tomi,2013-01-27,,,within an hour,100%,92%,t,https://a0.muscache.com/im/users/4861661/profile_pic/1383654965/original.jpg?aki_policy=profile_small,https://a0.muscache.com/im/users/4861661/profile_pic/1383654965/original.jpg?aki_policy=profile_x_medium,,2,2,"['email', 'phone']",t,t,"Budapest, Hungary",VI. kerület,,47.50179,19.05799,Entire loft,Entire home/apt,2,1.0,1 bath,1.0,2.0,"[""Paid parking off premises"", ""Oven"", ""Hair dryer"", ""Microwave"", ""Heating"", ""Coffee maker"", ""Wifi"", ""Shampoo"", ""Hot water"", ""Free washer \u2013 In unit"", ""Self check-in"", ""Refrigerator"", ""Iron"", ""Stove"", ""Dishes and silverware"", ""Hangers"", ""Kitchen"", ""Cooking basics"", ""Essentials"", ""Bed linens"", ""Lockbox""]","$16,592.00",2,1125,2,2,1125,1125,2.0,1125.0,,t,16,37,60,147,2025-05-25,332,52,2,147,55,255,4230960.0,2013-10-28,2025-05-13,4.8,4.89,4.79,4.8,4.87,4.96,4.85,,f,2,2,0,0,2.36
137,925338,https://www.airbnb.com/rooms/925338,20250525024250,2025-05-25,city scrape,central flat VACI UTCA max 4 people,,,https://a0.muscache.com/pictures/fbc3cf75-1d0c-4c8a-bf3b-3498fb95547a.jpg,1778089,https://www.airbnb.com/users/show/1778089,Ferdinando,2012-02-20,Italy,"“One’s destination is never a place, but a new way of seeing things.” – Henry Miller


Welcome to Budapest ! 
",within an hour,100%,53%,t,https://a0.muscache.com/im/users/1778089/profile_pic/1370857200/original.jpg?aki_policy=profile_small,https://a0.muscache.com/im/users/1778089/profile_pic/1370857200/original.jpg?aki_policy=profile_x_medium,Józsefváros - District VIII.,4,5,"['email', 'phone']",t,t,,V. kerület,,47.49135,19.0555,Entire rental unit,Entire home/apt,4,1.0,1 bath,1.0,1.0,"[""Carbon monoxide alarm"", ""Hot water kettle"", ""Oven"", ""Hair dryer"", ""Microwave"", ""Fast wifi \u2013 135 Mbps"", ""Heating"", ""Coffee maker"", ""Shampoo"", ""Host greets you"", ""Hot water"", ""Exterior security cameras on property"", ""Refrigerator"", ""Washer"", ""Iron"", ""Stove"", ""Smoke alarm"", ""Dishes and silverware"", ""Hangers"", ""Kitchen"", ""Cooking basics"", ""TV with standard cable"", ""Essentials"", ""AC - split type ductless system""]","$19,101.00",3,365,3,3,365,365,3.0,365.0,,t,6,17,38,128,2025-05-25,80,2,0,128,1,12,229212.0,2013-07-27,2025-02-10,4.8,4.85,4.89,4.96,4.97,4.88,4.8,MA20007470,f,3,3,0,0,0.56
138,928743,https://www.airbnb.com/rooms/928743,20250525024250,2025-05-25,city scrape,Andrássy - Kódaly heritage building,Welcome to our apartment! We hope we can share with you this lovely place while you are in Budapest. If you want to stay in the center of the city but looking for a calm island where you can have rest after the long day our apartment is your place.,"Our apartment has an excellent location, we are just a few steps from the main tourist attractions, a lovely park, the Széchenyi Thermal Bath etc. The street Andrassy Avenue is one of the most famous avenues in Budapest (it is listed as World Heritage Site and our flat is located one of the Kodály körönds heritage building.) <br />The neighborhood Terézváros (6th district) is the most cosmopolitan quarter of Budapest",https://a0.muscache.com/pictures/miso/Hosting-928743/original/ec5c73a3-a584-477f-9d29-f9d905edc213.jpeg,4999880,https://www.airbnb.com/users/show/4999880,Jul,2013-02-07,"Sant Just Desvern, Spain",We like to recommend guest what to do when they are in Barcelona or Budapest and the explain them the secret places in the town.,within an hour,100%,100%,f,https://a0.muscache.com/im/users/4999880/profile_pic/1360252849/original.jpg?aki_policy=profile_small,https://a0.muscache.com/im/users/4999880/profile_pic/1360252849/original.jpg?aki_policy=profile_x_medium,Terézváros - District VI.,3,28,"['email', 'phone']",t,t,"Budapest, Hungary",VI. kerület,,47.50929,19.07096,Entire rental unit,Entire home/apt,6,1.5,1.5 baths,2.0,3.0,"[""Shower gel"", ""Backyard"", ""Paid parking off premises"", ""Carbon monoxide alarm"", ""Hot water kettle"", ""Toaster"", ""Oven"", ""Hair dryer"", ""Microwave"", ""Electric stove"", ""Cleaning products"", ""Coffee maker"", ""Body soap"", ""Elevator"", ""Wifi"", ""Shampoo"", ""Hot water"", ""Wine glasses"", ""Dishwasher"", ""Free washer \u2013 In unit"", ""Central heating"", ""Self check-in"", ""Refrigerator"", ""Private entrance"", ""Dining table"", ""Dedicated workspace"", ""Free parking on premises"", ""Iron"", ""Freezer"", ""Bathtub"", ""Extra pillows and blankets"", ""Paid parking on premises"", ""Clothing storage: closet and wardrobe"", ""Hangers"", ""Room-darkening shades"", ""Dishes and silverware"", ""Drying rack for clothing"", ""Kitchen"", ""Coffee"", ""Cooking basics"", ""TV with standard cable"", ""Single level home"", ""Books and reading material"", ""Portable fans"", ""Blender"", ""Essentials"", ""Luggage dropoff allowed"", ""Bed linens"", ""Lockbox""]","$49,888.00",5,31,5,14,30,1125,6.4,956.1,,t,0,22,47,56,2025-05-25,4,2,0,56,2,20,997760.0,2017-08-01,2024-08-29,5.0,4.75,4.25,5.0,5.0,5.0,5.0,MA23077447,f,1,1,0,0,0.04
