168,1261932,https://www.airbnb.com/rooms/1261932,20250525024250,2025-05-25,city scrape,Castle district great location,,,https://a0.muscache.com/pictures/20136975/f384b9ea_original.jpg,6872740,https://www.airbnb.com/users/show/6872740,Oscar,2013-06-12,"Budapest, Hungary", I have travelled all over the World and I like to host people in my hometown from every part of the World. ,,,29%,f,https://a0.muscache.com/im/users/6872740/profile_pic/1372074675/original.jpg?aki_policy=profile_small,https://a0.muscache.com/im/users/6872740/profile_pic/1372074675/original.jpg?aki_policy=profile_x_medium,District I.,1,1,"['email', 'phone']",t,t,,I. kerület,,47.49974,19.02603,Entire rental unit,Entire home/apt,2,1.0,1 bath,1.0,1.0,"[""Heating"", ""Wifi"", ""Kitchen"", ""Dishes and silverware"", ""Hot water"", ""Cooking basics"", ""Iron"", ""TV with standard cable"", ""Oven"", ""Dishwasher"", ""Essentials"", ""Hair dryer"", ""Stove"", ""Air conditioning"", ""Microwave"", ""Refrigerator"", ""Hangers""]","$13,627.00",2,1123,2,2,1123,1123,2.0,1123.0,,t,0,0,0,81,2025-05-25,113,7,0,81,11,42,572334.0,2013-07-19,2024-09-26,4.89,4.93,4.93,4.78,4.79,4.78,4.89,,f,1,1,0,0,0.78
169,1266211,https://www.airbnb.com/rooms/1266211,20250525024250,2025-05-31,city scrape,Sunlit forest in the city center,"In the centre of Budapest next to Opera House, we offer a very bright apartment with roof windows, inspired by the forest, featuring many natural elements. The place is in the heart of the city close to many places of interest, and will give you the chance to really live like a local! It's a good fit for couples and groups of people who want to stay in two separate bedrooms with real beds.","You'll find the main tourist attractions very close, the apartment is within a short walking distance from the Great Synagogue, the Basilica, Opera House and the popular party quarter, the Soho of Budapest with unique and lovely 'ruin pubs', bars and restaurants. You'll have plenty of choices to dine out or go for a drink without having to use a taxi or public transport. The area is highly recommended for fun-loving travellers.",https://a0.muscache.com/pictures/8a9902e7-9525-4b5b-932f-8cd231c6d303.jpg,6892971,https://www.airbnb.com/users/show/6892971,Aron & Eva,2013-06-13,"Budapest, Hungary","Friends since the age of 10, we have also joined forces to ensure that you make the most of your stay in Budapest!

Aron has been hosting guests at his own apartment through Airbnb since 2013, and starting from 2014, he has also been managing other apartments as well. Eva joined him in 2015, and they have since been working on ways to make guests' trips to Budapest unforgettable.

We were both born and raised in Budapest and know the city like the back of our hands. We love welcoming travellers and showing them what this beautiful place has to offer. We do our best to welcome all guests in person or send a friend when neither of us can make it to make sure you are in good hands. We are happy to answer all your questions and give you recommendations on where to go and what to see!

On a more personal note, Aron loves sports, especially hockey and badminton, and tries to live an active life, also using his bike as everyday transport in the city. The most important things in his life are his little son and daughter, who are keeping them busy and giving them a life full of joy.

Eva's personal interests include community building and volunteering, and she hopes to help making this world a better place through education and charity work. She also translates and organises community events, and is admittedly an Anglophile and very fond of Shakespeare. She also sings in a band along with her dad!

We both love travelling and meeting new people, and we believe that Airbnb grants a unique opportunity to do both.

So that's our story. What's yours?",within an hour,100%,99%,t,https://a0.muscache.com/im/pictures/user/8ca127a3-ecfe-4080-be54-e59c0edbec3e.jpg?aki_policy=profile_small,https://a0.muscache.com/im/pictures/user/8ca127a3-ecfe-4080-be54-e59c0edbec3e.jpg?aki_policy=profile_x_medium,Terézváros - District VI.,2,23,"['email', 'phone']",t,t,"Budapest, Hungary",VI. kerület,,47.50171,19.0594,Entire rental unit,Entire home/apt,6,1.5,1.5 baths,1.0,1.0,"[""Carbon monoxide alarm"", ""Air conditioning"", ""Stove"", ""TV with standard cable"", ""Wifi \u2013 13 Mbps"", ""Heating"", ""Coffee maker"", ""Bed linens"", ""Self check-in"", ""Iron"", ""Long term stays allowed"", ""Washer"", ""Hot water"", ""Hangers"", ""Lockbox"", ""Essentials"", ""Kitchen"", ""Dishes and silverware"", ""Hair dryer"", ""Paid parking off premises"", ""Cooking basics"", ""Smoke alarm"", ""Refrigerator"", ""Oven"", ""Microwave""]","$16,851.00",2,90,1,4,90,90,2.0,90.0,,t,11,23,35,111,2025-05-31,451,11,1,111,11,66,1112166.0,2013-07-16,2025-05-03,4.77,4.84,4.71,4.88,4.9,4.9,4.8,,t,2,2,0,0,3.12
170,1280195,https://www.airbnb.com/rooms/1280195,20250525024250,2025-05-25,city scrape,Little Panther Apartment+free wine,Great central located base to explore Budapest. 24/7 check-in keyholder system. <br />Very comfortable apartment with a fully equipped kitchen and high speed wifi internet!<br />If you can consider other people between 10pm-6am and avoid partying in the apartment then this is your place!<br />No party! No heavy drinking! No smoking in the apartment!,"Very central, all major sightseeing are nearby!",https://a0.muscache.com/pictures/miso/Hosting-1280195/original/1926eba3-ea17-4075-a952-2c8661f99640.jpeg,6966181,https://www.airbnb.com/users/show/6966181,Iván,2013-06-17,"Budapest, Hungary","Easy going, fun guy :D",within an hour,100%,100%,f,https://a0.muscache.com/im/users/6966181/profile_pic/1371505307/original.jpg?aki_policy=profile_small,https://a0.muscache.com/im/users/6966181/profile_pic/1371505307/original.jpg?aki_policy=profile_x_medium,Erzsébetváros - District VII.,3,3,"['email', 'phone', 'work_email']",t,t,"Budapest, Hungary",VII. kerület,,47.50044,19.06776,Entire rental unit,Entire home/apt,2,1.0,1 bath,1.0,1.0,"[""Carbon monoxide alarm"", ""Hair dryer"", ""Air conditioning"", ""Microwave"", ""Heating"", ""Wifi"", ""Shampoo"", ""Exterior security cameras on property"", ""Self check-in"", ""Refrigerator"", ""Dedicated workspace"", ""Iron"", ""Smoke alarm"", ""Dishes and silverware"", ""Kitchen"", ""Cooking basics"", ""TV with standard cable"", ""Essentials"", ""Lockbox""]","$17,062.00",3,28,1,5,28,28,1.3,28.0,,t,4,14,38,164,2025-05-25,104,3,1,164,3,18,307116.0,2013-07-25,2025-05-04,4.71,4.74,4.55,4.83,4.89,4.86,4.78,,f,3,3,0,0,0.72
171,1283159,https://www.airbnb.com/rooms/1283159,20250525024250,2025-05-25,city scrape,Magic garden apartment A/C +2 bikes,"Magical garden apartment at an absolute central location!<br /><br />FREE BICYCLES<br />A/C<br />high speed internet + FREE WIFI + computer <br />free breakfast ( cereal, corn flakes, milk, tea, honey) <br />free sheets and towels <br />free mobile phone for local communication","You are in the heart of the city, close to the busy city life but in a peaceful environment<br />100m away from metro and also 24/7 tramlines that come every couple of minutes. Several bus lines are available right around the corner",https://a0.muscache.com/pictures/1a1f116c-6e9a-43a8-a956-f0ebe2be56e3.jpg,6980691,https://www.airbnb.com/users/show/6980691,Monika And Viktor,2013-06-18,"Budapest, Hungary","I like theater, litterature, films, music, dance, arts in general. I am a person who likes freedom, tolerance and diversity. I like studying foreign languages and naturally travalling in different countries. I would be glad to welcome you in my charming apartment in Budapest ! If you have any questions, please, do not hesitate to ask me.",,,,f,https://a0.muscache.com/im/users/6980691/profile_pic/1414113873/original.jpg?aki_policy=profile_small,https://a0.muscache.com/im/users/6980691/profile_pic/1414113873/original.jpg?aki_policy=profile_x_medium,Terézváros - District VI.,1,2,"['email', 'phone', 'work_email']",t,t,"Budapest, Hungary",VI. kerület,,47.50624,19.06366,Entire rental unit,Entire home/apt,2,1.0,1 bath,1.0,1.0,"[""Backyard"", ""Patio or balcony"", ""Carbon monoxide alarm"", ""Oven"", ""Hair dryer"", ""Air conditioning"", ""Microwave"", ""Smart lock"", ""Heating"", ""Wifi"", ""Shampoo"", ""Hot water"", ""Fire extinguisher"", ""Dishwasher"", ""Breakfast"", ""Self check-in"", ""Refrigerator"", ""Washer"", ""Iron"", ""Bathtub"", ""Extra pillows and blankets"", ""Paid parking on premises"", ""Stove"", ""Smoke alarm"", ""Hangers"", ""Room-darkening shades"", ""Dishes and silverware"", ""Kitchen"", ""Cooking basics"", ""TV with standard cable"", ""Essentials"", ""Long term stays allowed"", ""Bed linens""]","$403,954.00",80,80,80,80,1125,1125,80.0,1125.0,,t,30,60,90,365,2025-05-25,432,0,0,221,0,0,0.0,2013-09-01,2022-03-10,4.91,4.93,4.87,4.97,4.97,4.92,4.93,MA19018540,t,1,1,0,0,3.02
172,1287104,https://www.airbnb.com/rooms/1287104,20250525024250,2025-05-25,city scrape,"Akacia Apartment, free inside parking, 2BR, garden",,,https://a0.muscache.com/pictures/3df8a6df-f0e7-4ff2-bdde-e12e6e872cab.jpg,7000193,https://www.airbnb.com/users/show/7000193,Sinkó,2013-06-19,"Budapest, Hungary","I was born and live all my life in Budapest, I have been working at a leader  pharmaceutical company as a chemist for over 40 years.  My hobby is the gardening - fruits production, at a land out of Budapest - so our guest alwasy can taste and enjoy our fresh fruits in the season. 
I'm running the apartment with my wife, she can speak english, I can speak german and a little italian. Our daughter is 31 years old, ",within an hour,100%,,f,https://a0.muscache.com/im/pictures/user/1fd60201-0779-4ae2-b882-b50c6ce5cda7.jpg?aki_policy=profile_small,https://a0.muscache.com/im/pictures/user/1fd60201-0779-4ae2-b882-b50c6ce5cda7.jpg?aki_policy=profile_x_medium,,1,2,"['email', 'phone']",t,t,,XIV. kerület,,47.516964,19.121611,Entire home,Entire home/apt,5,1.0,1 bath,2.0,4.0,"[""Shower gel"", ""Hair dryer"", ""Microwave"", ""HDTV with standard cable, DVD player"", ""Private patio or balcony"", ""Heating"", ""Coffee maker"", ""Shampoo"", ""Host greets you"", ""Hot water"", ""Fire extinguisher"", ""Outdoor furniture"", ""Refrigerator"", ""Private entrance"", ""Outdoor dining area"", ""Dedicated workspace"", ""Free parking on premises"", ""Iron"", ""Private backyard \u2013 Not fully fenced"", ""Baby safety gates"", ""Wifi \u2013 28 Mbps"", ""Stove"", ""Smoke alarm"", ""Free street parking"", ""Hangers"", ""Dishes and silverware"", ""Kitchen"", ""Cooking basics"", ""Luggage dropoff allowed"", ""Essentials"", ""Long term stays allowed"", ""Bed linens"", ""Washer \u2013\u00a0In building""]","$53,668.00",3,1100,3,3,1100,1100,3.0,1100.0,,t,20,50,75,348,2025-05-25,11,0,0,204,0,0,0.0,2013-10-26,2023-07-22,4.6,4.73,5.0,4.82,4.91,4.64,4.64,MA19006699,f,1,1,0,0,0.08
173,1320929,https://www.airbnb.com/rooms/1320929,20250525024250,2025-05-25,city scrape,3 bedroom/ 2 bathroom+balcony suite at Opera House,"Offered by me: <br />personal city walking tour ,  and home restaurant , ask information  <br /><br />others :<br />- complimentary welcome coffee , tea <br />- fresh bed linens , towels <br />- shampoo , shower gel , toilet papers  <br />- coffee grinder  , fresh coffee beans <br />- washing powder , washing machine + dryer rack <br />- personal welcome<br />_ pick up transfer arranged by personal driver for request","In the heart of Jewish quarter. <br />Next to the Opera House + ""W luxury Marriott ***** Hotel "" .<br />Close by , Great Synagogue , Basilica , Andrassy - avenue .<br />The location is the trendy , lively neighbourhood but in a small quiet street . <br />The former Jewish quarter has a quaint atmosphere with characteristic people, striking contrast of crumbling buildings and shiny new apartment blocks and unique monuments .<br />This bright, spacious 100 m2 airy apartment has south facing balcony ideal for morning coffee or a glass of wine at nightfall while you have a great view to the authentic Jewish quarter .<br />This house is a 120 years old original Jewish house .",https://a0.muscache.com/pictures/hosting/Hosting-1320929/original/e5f2c801-3185-4de2-a8a0-9ae9db09f7c8.jpeg,2850,https://www.airbnb.com/users/show/2850,Janos,2008-09-09,"Budapest, Hungary","Hello , I am Janos ,
I am hugarian , was born in Budapest and live here since that .
I worked on a crew ship three contracts as a waiter after moved back to Budapest and worked in few  five stars Hotels ( hotel Hilton , hotel Marriott , hotel Intercontinental , hotel Four Season )  .
Because I loved my job and I could meet many different guests from different culture I just thought I will do my own airbnb at the moment I manage with my best friend Jozsef some self catering apartments and a classical B&B room since 2008. 
We welcome our all guests personally and give city information and useful tips for thermal baths share our experience  where to eat , listen live music and actual programms . 
At the same time I do personal guided city walks to learn about history and locals day to day life , show the city hidden beauty   .
Feel free to write before you book if you have any question ,
thank you Janos .   ",within an hour,100%,98%,t,https://a0.muscache.com/im/pictures/user/79fa76dc-a941-4cee-a3a9-ca54664352d1.jpg?aki_policy=profile_small,https://a0.muscache.com/im/pictures/user/79fa76dc-a941-4cee-a3a9-ca54664352d1.jpg?aki_policy=profile_x_medium,District XIII.,3,4,"['email', 'phone']",t,t,"Budapest, Hungary",VI. kerület,,47.50089,19.05972,Entire condo,Entire home/apt,6,2.0,2 baths,3.0,4.0,"[""Shower gel"", ""Carbon monoxide alarm"", ""Hot water kettle"", ""Toaster"", ""Oven"", ""Hair dryer"", ""HDTV with standard cable"", ""Microwave"", ""Crib"", ""Courtyard view"", ""Private patio or balcony"", ""Heating"", ""Body soap"", ""Coffee maker"", ""Wifi"", ""Shampoo"", ""Host greets you"", ""Hot water"", ""Wine glasses"", ""Free washer \u2013 In unit"", ""Central air conditioning"", ""Refrigerator"", ""Private entrance"", ""Dining table"", ""Dedicated workspace"", ""City skyline view"", ""Pack \u2019n play/Travel crib"", ""Children\u2019s books and toys"", ""Iron"", ""Freezer"", ""Bathtub"", ""Paid parking on premises"", ""Stove"", ""Smoke alarm"", ""Hangers"", ""Room-darkening shades"", ""Dishes and silverware"", ""Drying rack for clothing"", ""Kitchen"", ""Cooking basics"", ""Portable fans"", ""Essentials"", ""Bed linens""]","$70,059.00",2,96,1,90,1125,1125,33.7,1125.0,,t,8,26,52,261,2025-05-25,121,7,0,166,5,42,2942478.0,2013-12-30,2025-04-21,4.82,4.83,4.95,4.89,4.9,4.85,4.74,MA19013341,f,3,3,0,0,0.87
174,1321812,https://www.airbnb.com/rooms/1321812,20250525024250,2025-05-25,city scrape,Parliament alkotmany apartment,,"The neighborhood is absolutely strategic near the Houses of Parliament : one of the most beautiful in the world, and close to all means of connection in the city.<br />Tram, Bus, Metro, Railway Station ample parking.",https://a0.muscache.com/pictures/19918970/42fbd54a_original.jpg,7176041,https://www.airbnb.com/users/show/7176041,Delfina,2013-06-29,"Naples, Italy",,within an hour,100%,100%,f,https://a0.muscache.com/im/users/7176041/profile_pic/1372498036/original.jpg?aki_policy=profile_small,https://a0.muscache.com/im/users/7176041/profile_pic/1372498036/original.jpg?aki_policy=profile_x_medium,Lipótváros,1,1,"['email', 'phone']",t,t,"Budapest, Hungary",V. kerület,,47.50652,19.05052,Entire rental unit,Entire home/apt,6,2.0,2 baths,2.0,3.0,"[""Hair dryer"", ""Heating"", ""Coffee maker"", ""Elevator"", ""Wifi"", ""Shampoo"", ""Hot water"", ""Free washer \u2013 In unit"", ""Self check-in"", ""Refrigerator"", ""Dedicated workspace"", ""City skyline view"", ""Iron"", ""22 inch TV"", ""Dishes and silverware"", ""Hangers"", ""Kitchen"", ""Luggage dropoff allowed"", ""Essentials"", ""Long term stays allowed"", ""Lockbox""]","$31,932.00",3,1125,3,3,1125,1125,3.0,1125.0,,t,26,56,66,340,2025-05-25,27,3,0,196,3,18,574776.0,2015-09-14,2025-04-20,4.59,4.7,4.52,4.74,4.7,4.89,4.48,,f,1,1,0,0,0.23
175,1338024,https://www.airbnb.com/rooms/1338024,20250525024250,2025-05-25,city scrape,centREsidence-lovely studio flat-cool neighborhood,"Bright and cozy downtown apartment, just opposite of a nice old market hall, and 2 minute far from metro line 4. Sleep in silence in my flat, what gives you everything what you need for your comfort.","I like my closer and bigger neighborhood also, in the house I met some people who had became friends, and the area where the apartment lies had developed a lot in the last few years, getting nicer and better. I am very curious about the continuation. You can find everything in 5 minutes what an urban citizen needs: bar, restaurant, market hall, pharmacy, post office, bank, etc.",https://a0.muscache.com/pictures/miso/Hosting-1338024/original/99fdbf74-815c-488e-aaba-731ccccd5126.jpeg,139143,https://www.airbnb.com/users/show/139143,Janka,2010-06-06,"Budapest, Hungary","I'm from Budapest, Hungary. I am an architect, but I am designing now just interiors like this one :)  I've been to few countries using airbnb to find accomodation. My family members provides easy communication in few languages, as Italian and Spanish. I like sports I'm kick-boxing in a team.",within an hour,100%,99%,t,https://a0.muscache.com/im/pictures/user/7356c7ae-f188-4247-a56d-2291c61c04a5.jpg?aki_policy=profile_small,https://a0.muscache.com/im/pictures/user/7356c7ae-f188-4247-a56d-2291c61c04a5.jpg?aki_policy=profile_x_medium,Józsefváros - District VIII.,1,1,"['email', 'phone', 'work_email']",t,t,"Budapest, Hungary",VIII. kerület,,47.49315,19.0738,Entire rental unit,Entire home/apt,4,1.0,1 bath,1.0,2.0,"[""Shower gel"", ""Laundromat nearby"", ""Carbon monoxide alarm"", ""Hot water kettle"", ""Toaster"", ""Hair dryer"", ""Microwave"", ""Crib"", ""Baby bath"", ""Cleaning products"", ""Heating"", ""Coffee maker"", ""Wifi"", ""Shampoo"", ""Host greets you"", ""Children\u2019s books and toys for ages 0-2 years old and 2-5 years old"", ""Hot water"", ""Wine glasses"", ""First aid kit"", ""Dishwasher"", ""Free washer \u2013 In unit"", ""Refrigerator"", ""Dining table"", ""Dedicated workspace"", ""Pack \u2019n play/Travel crib"", ""Iron"", ""Clothing storage: wardrobe"", ""Freezer"", ""Extra pillows and blankets"", ""Children\u2019s bikes"", ""Paid parking on premises"", ""Stove"", ""Stainless steel single oven"", ""Smoke alarm"", ""Hangers"", ""Room-darkening shades"", ""Dishes and silverware"", ""Board games"", ""Drying rack for clothing"", ""Baking sheet"", ""Kitchen"", ""Cooking basics"", ""TV with standard cable"", ""Books and reading material"", ""Ethernet connection"", ""Essentials"", ""Bed linens"", ""AC - split type ductless system""]","$17,303.00",2,1125,2,7,1125,1125,4.6,1125.0,,t,14,44,60,240,2025-05-25,487,45,1,191,37,255,4412265.0,2013-07-18,2025-05-10,4.9,4.95,4.84,4.94,4.94,4.78,4.92,EG20006519,f,1,1,0,0,3.37
176,1344349,https://www.airbnb.com/rooms/1344349,20250525024250,2025-05-25,city scrape,CHAMP's Inn,"This is a historical fashioned building in the center of Budapest since 1884,which had a full restoration with panorama elevator and original architectures. The house and the flat both has an antique vintage design mixed with modern and renovated style in the heart of Budapest, where is easy to reach all of the historical sites,party sceenes or thermal baths, and WESTEND Shopping MALL, even by foot while it's a few blocks off from Andrássy Ave so you won t be bothered by the main street's noise.","The following attractions are all within a short walk from the apartment:<br />Parliament<br />Basilica<br />Opera<br />Deák Square (Ruin Pubs)<br />Margit Island<br />River Danube<br />Thermal Baths<br />Chain Bridge<br />Westend shopping center<br />House of terror museum / all about the dictatorships<br />Andrassy Avenue<br />Octagon Square / with restaurants, coffee and tea houses<br /><br />A 15-20 minute walk will take you to the following:<br />Raday Street / restaurants<br />Buda Castle<br />Szechenyi Baths<br />City Park<br />Ice rink<br />Heroes Square<br />Budapest Zoo<br />Famous Váci street",https://a0.muscache.com/pictures/20252085/187d28ab_original.jpg,7293050,https://www.airbnb.com/users/show/7293050,Gergo,2013-07-05,"Budapest, Hungary","HI! I'm Gergo from Budapest. This city is my second son. I like to meet new people from all around the world. I have been travelling to different countries during the years, which have taught me what are the things any guest would want, so I equipped my apartment according to these experiences.
I have been living in Budapest since I was born, so I can give you advice on everything, from touristy places and attractions to restaurants and nightclubs.
If you need any help don't hesitate to message me!

Waiting to see you soon in one of my apartments! :)",within an hour,100%,98%,t,https://a0.muscache.com/im/pictures/user/708cd539-0e4e-469b-b573-3a7e63bd9e80.jpg?aki_policy=profile_small,https://a0.muscache.com/im/pictures/user/708cd539-0e4e-469b-b573-3a7e63bd9e80.jpg?aki_policy=profile_x_medium,Terézváros - District VI.,3,3,"['email', 'phone']",t,t,"Budapest, Hungary",VI. kerület,,47.50968,19.06664,Entire condo,Entire home/apt,4,1.0,1 bath,2.0,2.0,"[""Laundromat nearby"", ""Hot water kettle"", ""Toaster"", ""Oven"", ""Hair dryer"", ""Air conditioning"", ""Microwave"", ""Heating"", ""Coffee maker"", ""Elevator"", ""Wifi"", ""Host greets you"", ""Hot water"", ""Wine glasses"", ""Self check-in"", ""Refrigerator"", ""Washer \u2013\u00a0In unit"", ""Private entrance"", ""Dining table"", ""Dedicated workspace"", ""Iron"", ""Clothing storage: wardrobe"", ""Freezer"", ""Bathtub"", ""EV charger"", ""Paid parking on premises"", ""Stove"", ""Hangers"", ""Room-darkening shades"", ""Dishes and silverware"", ""Drying rack for clothing"", ""Kitchen"", ""Cooking basics"", ""TV with standard cable"", ""Essentials"", ""Long term stays allowed"", ""Bed linens"", ""Lockbox""]","$14,946.00",1,1125,1,5,1125,1125,1.2,1125.0,,t,22,46,72,93,2025-05-25,344,41,2,93,41,246,3676716.0,2016-04-28,2025-05-10,4.85,4.9,4.74,4.94,4.97,4.79,4.83,MA23427671,f,3,3,0,0,3.11
