162,1210375,https://www.airbnb.com/rooms/1210375,20250525024250,2025-05-25,city scrape,Vibrant and Artful Apartment With Secret Balcony,"Ride a vintage elevator to an apartment in a quaint period building. Enter a completely remodeled space that's an ode to simplicity and unabashed color. Framed artwork adorns the walls and a striking Pop Art sensibility carries through to every room. A big plus, the apartment has a small balcony that provides an exceptional view of the rooftops of Budapest.","This studio apartment is in the very heart of Downtown Budapest. It's right next to a famous pedestrian area that's full of bars, pubs, cafes, and clubs. So you'll have plenty of choices to dine out or go for a drink without having to use a taxi or public transport. The area is highly recommended for fun-loving travelers.<br /><br />You'll find the main tourist attractions very close, the apartment is within a short walking distance from the Great Synagogue, the Basilica, and River Danube.",https://a0.muscache.com/pictures/18e7aa10-f0b0-4357-9693-44bd8f5352f1.jpg,6610258,https://www.airbnb.com/users/show/6610258,Rita,2013-05-28,"Budapest, Hungary","We are a Hungarian couple, we both are architects. We run our own design studio in Budapest, downtown. We grew up in this fabulous city, so we know every little secret of it. We love Budapest as it is, and we're sure, that you will feel the same after visiting us. The accomodation we offer is brand new, cosy, with an exquisite view from the small balcony. We supply all equipment you need, including wifi. If it is important for you to stay in a flat which is in the heart of the city, close to everything, but is in a quiet street, then you should definitely book our studio apartment. If you have any questions, don't hesitate to contact us. We are looking forward to seeing you. Rita&Marci",within an hour,100%,100%,t,https://a0.muscache.com/im/users/6610258/profile_pic/1371738566/original.jpg?aki_policy=profile_small,https://a0.muscache.com/im/users/6610258/profile_pic/1371738566/original.jpg?aki_policy=profile_x_medium,Belváros,2,2,"['email', 'phone']",t,t,"Budapest, Hungary",V. kerület,,47.49177,19.05644,Entire rental unit,Entire home/apt,2,1.0,1 bath,1.0,1.0,"[""Shower gel"", ""Patio or balcony"", ""Paid parking off premises"", ""Carbon monoxide alarm"", ""Hot water kettle"", ""Hair dryer"", ""Microwave"", ""Heating"", ""Coffee maker"", ""Shampoo"", ""Self check-in"", ""Refrigerator"", ""Fast wifi \u2013 292 Mbps"", ""Iron"", ""Extra pillows and blankets"", ""Stove"", ""Smoke alarm"", ""Dishes and silverware"", ""Hangers"", ""Kitchen"", ""Cooking basics"", ""TV"", ""Portable fans"", ""Essentials"", ""Long term stays allowed"", ""Bed linens"", ""Lockbox""]","$21,491.00",2,90,1,4,1125,1125,2.1,1125.0,,t,15,45,75,172,2025-05-25,599,76,7,172,68,255,5480205.0,2013-07-07,2025-05-17,4.75,4.86,4.76,4.92,4.88,4.94,4.83,MA21029383,t,2,2,0,0,4.14
163,1211553,https://www.airbnb.com/rooms/1211553,20250525024250,2025-05-25,city scrape,Caesar Budapest Apartman,"The Caesar Apartman is a 5-minute walk from the Margaret Bridge and the Margaret Island offering a well-equipped kitchen, free WiFi and airport shuttle for a surcharge. Public parking is possible on site.<br /><br />The apartment consists of a modernly furnished, spacious room with a seating area with a sofa bed and a double bed. The kitchen comes with a microwave, a coffee machine, and the bathroom is fitted with a bathtub.","The City Center is 2 only stations, but the Airport is also reachable with the metro and a bus in 60 minutes.  The popular Pozsonyi street with its lovely restaurants, confectioneries, delis, and coffees is in 500 meters distance. The Parliament is 1000 meters from Caesar Apartment, while Margaret Island is 1200 meters away.",https://a0.muscache.com/pictures/60699586/49396073_original.jpg,6613272,https://www.airbnb.com/users/show/6613272,Alexandra,2013-05-28,"Budapest, Hungary","Hello! I would like to briefly describe myself to give an idea of what can you expect from me as a host. I am generally open-minded and I love getting to know people from all over the world. When I host guests at one of the apartments I try to make the most out of their stay and I am glad to help with almost anything but in exchange I expect guests to leave the apartments clean and tidy. As a guest I would like to receive a similar treatment ;) I'm happy to offer help and advice to transform a simple vacation into something unforgettable!
Do not hesitate to contact me anytime! I can't wait to hear from you!
Buongiorno! Voglio descrivermi in breve in modo che sappiate con chi siete in contatto. Sono ungherese, amo conoscere nuova gente. Quando ospito qualcuno presso le mie abitazioni desidero che trovi un ambiente molto pulito e confortevole. Cerco di offrire il massimo e spero sempre di ricevere lo stesso trattamento quando sono io ad andare in affitto come ospite;) Mi piace poter offrire assistenza e consigli per trasformare una semplice vacanza in qualcosa di indimenticabile! Non esitate a contattarmi quando preferite! Sarò felice di rispondervi!...",within a few hours,100%,10%,,https://a0.muscache.com/im/users/6613272/profile_pic/1369743438/original.jpg?aki_policy=profile_small,https://a0.muscache.com/im/users/6613272/profile_pic/1369743438/original.jpg?aki_policy=profile_x_medium,Lipótváros,5,5,"['email', 'phone']",t,t,"Budapest, Hungary",V. kerület,,47.51188,19.05092,Entire rental unit,Entire home/apt,4,1.0,1 bath,1.0,2.0,"[""Shower gel"", ""Hot water kettle"", ""Toaster"", ""Oven"", ""Window AC unit"", ""Hair dryer"", ""Microwave"", ""Cleaning products"", ""Heating"", ""Body soap"", ""Coffee maker"", ""Elevator"", ""Shampoo"", ""Host greets you"", ""Hot water"", ""Wine glasses"", ""Free washer \u2013 In unit"", ""Bed linens"", ""Private hot tub"", ""Refrigerator"", ""Private entrance"", ""Dining table"", ""Dedicated workspace"", ""City skyline view"", ""Iron"", ""Freezer"", ""Bathtub"", ""Extra pillows and blankets"", ""Wifi \u2013 48 Mbps"", ""Cleaning available during stay"", ""Stainless steel electric stove"", ""Hangers"", ""Room-darkening shades"", ""Dishes and silverware"", ""HDTV with standard cable, premium cable"", ""Drying rack for clothing"", ""Kitchen"", ""Coffee"", ""Cooking basics"", ""Luggage dropoff allowed"", ""Essentials"", ""Long term stays allowed"", ""Children\u2019s dinnerware""]","$46,598.00",3,1125,3,5,1125,1125,3.1,1125.0,,t,17,33,55,169,2025-05-25,14,0,0,164,0,0,0.0,2014-07-05,2023-10-23,4.71,4.86,4.64,5.0,5.0,4.86,4.71,MA19014744,f,3,3,0,0,0.11
164,1211741,https://www.airbnb.com/rooms/1211741,20250525024250,2025-05-25,city scrape,Casa Lara - Cozy Retreat Near Buda Castle,"Prime location, just steps from the castle and two major transport hubs. <br />Enjoy tranquility and convenience in one perfect spot. Relax in a serene Buda retreat near the iconic Buda Castle! This stylishly renovated apartment offers a peaceful escape with a fully equipped kitchen, a cozy sitting room with sofa beds and a TV, and a charming bedroom with twin beds. Enjoy breakfast on the balcony and modern comforts like high-speed WiFi and air conditioning.","Stay in the heart of Budapest – Excellent location - show map<br />In the 2nd district of Budapest and within a 10-minute walk from the Buda Castle, the air-conditioned CasaLara-Cosy Nest Near Buda Castle features accommodation with modern facilities, including free WiFi, a dishwasher and a washing machine.<br /><br />The self-catered unit contains a balcony, as well as a bedroom, a living room with a seating and dining area, a separate kitchen and a bathroom.<br />Metro stations of Batthanyi Square and Szell Kalman Square are both reachable in 10 minutes on foot.",https://a0.muscache.com/pictures/miso/Hosting-1211741/original/c2cef6f1-7977-4be8-9de4-7f6488e560dc.jpeg,6613272,https://www.airbnb.com/users/show/6613272,Alexandra,2013-05-28,"Budapest, Hungary","Hello! I would like to briefly describe myself to give an idea of what can you expect from me as a host. I am generally open-minded and I love getting to know people from all over the world. When I host guests at one of the apartments I try to make the most out of their stay and I am glad to help with almost anything but in exchange I expect guests to leave the apartments clean and tidy. As a guest I would like to receive a similar treatment ;) I'm happy to offer help and advice to transform a simple vacation into something unforgettable!
Do not hesitate to contact me anytime! I can't wait to hear from you!
Buongiorno! Voglio descrivermi in breve in modo che sappiate con chi siete in contatto. Sono ungherese, amo conoscere nuova gente. Quando ospito qualcuno presso le mie abitazioni desidero che trovi un ambiente molto pulito e confortevole. Cerco di offrire il massimo e spero sempre di ricevere lo stesso trattamento quando sono io ad andare in affitto come ospite;) Mi piace poter offrire assistenza e consigli per trasformare una semplice vacanza in qualcosa di indimenticabile! Non esitate a contattarmi quando preferite! Sarò felice di rispondervi!...",within a few hours,100%,10%,,https://a0.muscache.com/im/users/6613272/profile_pic/1369743438/original.jpg?aki_policy=profile_small,https://a0.muscache.com/im/users/6613272/profile_pic/1369743438/original.jpg?aki_policy=profile_x_medium,Lipótváros,5,5,"['email', 'phone']",t,t,"Budapest, Hungary",II. kerület,,47.508650484055465,19.034265407369343,Entire rental unit,Entire home/apt,6,1.0,1 bath,1.0,5.0,"[""Shower gel"", ""Hot water kettle"", ""Toaster"", ""Oven"", ""Conditioner"", ""Housekeeping available every day - available at extra cost"", ""Hair dryer"", ""Microwave"", ""Private patio or balcony"", ""Cleaning products"", ""Heating"", ""Body soap"", ""Coffee maker"", ""Elevator"", ""Shampoo"", ""Host greets you"", ""Hot water"", ""Wine glasses"", ""Dishwasher"", ""Central air conditioning"", ""Fast wifi \u2013 286 Mbps"", ""Refrigerator"", ""HDTV with premium cable, standard cable"", ""Private entrance"", ""Paid parking lot off premises"", ""Dining table"", ""Dedicated workspace"", ""Paid crib"", ""Iron"", ""Clothing storage: wardrobe"", ""Freezer"", ""Bathtub"", ""Safe"", ""Bread maker"", ""Paid parking lot on premises"", ""Stove"", ""Hangers"", ""Room-darkening shades"", ""Dishes and silverware"", ""Baking sheet"", ""Kitchen"", ""Coffee"", ""Cooking basics"", ""Luggage dropoff allowed"", ""Books and reading material"", ""Blender"", ""Essentials"", ""Long term stays allowed"", ""Bed linens""]","$16,360.00",3,1125,3,5,1125,1125,3.1,1125.0,,t,25,55,75,255,2025-05-25,47,1,0,206,2,6,98160.0,2014-11-03,2024-07-22,4.64,4.64,4.66,4.89,4.85,4.64,4.66,MA20000875,f,3,3,0,0,0.37
165,1212888,https://www.airbnb.com/rooms/1212888,20250525024250,2025-05-25,city scrape,"Chic studio, breathtaking view",You just found a nice and compact little apartment with fantastic panorama to Budapest ;) It was thoroughly refurbished recently and it is fully equipped.,"The flat is situated on the Buda side, very close to the Danube bank and thus it has a great access to all major tourist attractions in town. The location is ideal if you want to stay close to the center of both Buda and Pest, yet prefer to have peace during the night and are curious to see a lesser-known aspect of Budapest. Stroll around the hilly neighboring streets of the Rózsadomb area and enjoy the atmosphere. You may see great examples of Bauhaus architecture, as well as old Art-Nouveau buildings.<br /><br />Closeby, you can find:<br />- Gül Baba's tomb, Ottoman monument also a great viewpoint<br />- A few gorgeous breakfast places<br />- Small antique/vintage shops and art galleries<br />- Local market on Széna tér<br />- Thermal water pools in Lukács, Király and Veli Bej Bath<br />- Kids playground and family programs at Millenáris Park<br />- Hungarian craft and food shops, designer market once a month in winter<br />- Shopping centers with cinemas<br />- Two free rubberized r",https://a0.muscache.com/pictures/23011259/e57941c3_original.jpg,9299991,https://www.airbnb.com/users/show/9299991,Zsuzsi,2013-10-08,"Budapest, Hungary","I love nature, art, sports and spending time with friends and family.  I am also an enthusiastic advocate for a green urban lifestyle.

After a super inspiring year in the lovely Edinburgh, Scotland and some travels around the globe, a couple of years ago I moved back to Budapest, this amazing hometown of mine. I truly believe this city has a lot to offer and there is plenty to discover. Good vibes, interesting art scene and some seriously good, more and more sustainable (vegan, farm to table) dining options!

My boyfriend, Mariusz is a Polish graphic designer living with me here in BP. You might be lucky enough to meet him, too.. :)",,,0%,f,https://a0.muscache.com/im/pictures/user/5f94a8fd-79d7-4850-a295-c364b158819b.jpg?aki_policy=profile_small,https://a0.muscache.com/im/pictures/user/5f94a8fd-79d7-4850-a295-c364b158819b.jpg?aki_policy=profile_x_medium,District II.,1,1,"['email', 'phone']",t,t,"Budapest, Hungary",II. kerület,,47.51265,19.03287,Entire rental unit,Entire home/apt,4,1.0,1 bath,1.0,2.0,"[""Shower gel"", ""Patio or balcony"", ""Carbon monoxide alarm"", ""Hair dryer"", ""Air conditioning"", ""Microwave"", ""Heating"", ""Coffee maker"", ""Elevator"", ""Wifi"", ""Shampoo"", ""Host greets you"", ""Hot water"", ""First aid kit"", ""Fire extinguisher"", ""Dishwasher"", ""Refrigerator"", ""Private entrance"", ""Washer"", ""City skyline view"", ""Iron"", ""Extra pillows and blankets"", ""Paid parking on premises"", ""Stove"", ""Smoke alarm"", ""Hangers"", ""Room-darkening shades"", ""Dishes and silverware"", ""Kitchen"", ""Cooking basics"", ""TV with standard cable"", ""Essentials"", ""Long term stays allowed"", ""Bed linens""]","$20,602.00",2,90,2,2,90,90,2.0,90.0,,t,0,0,0,144,2025-05-25,143,0,0,0,0,0,0.0,2013-06-01,2021-09-15,4.96,4.99,4.96,4.96,4.99,4.73,4.9,MA19020737,f,1,1,0,0,0.98
166,1229785,https://www.airbnb.com/rooms/1229785,20250525024250,2025-05-25,city scrape,Free bikes / Pro Big Kitchen / Central / AC / Wifi,"The 83 sqm flat is situated in the heart of Budapest, which is furnished by unique and design furniture. In the huge and fully equipped kitchen guests can cook from all ingredients they find. There are two bikes for free of charge. Free wifi, and the best coffee machine! New: air conditioner in the bedroom!","The apartment is situated in the heart of Budapest, 5 min. walking from the Parliament, 3 min. from the Danube, 3 min. from the Nyugati train station, 10 min. from the Margaret island, 15 min. from the Basilica and the party area.<br />In case you do not want to walk, you can use the two bikes which are at your disposal.<br /><br />The area is full of good wineries, restaurants, bars, shops, antiquities. <br /><br />When you reserve the flat, I send you a list of places to visit, to eat and to discover.",https://a0.muscache.com/pictures/19812079/c601fe9d_original.jpg,429770,https://www.airbnb.com/users/show/429770,Anna,2011-03-08,"Budapest, Hungary","Hi, I am Anna, I live both in the capital and  in the countryside of Hungary. I love Budapest for its many-sided face and colorful life. And I love  to live in the countryside, for its peaceful and euphoric atmosphere. 
I love to discover new places, new people, new smells, new tastes, new touches, new feelings. 
I am passionated of food. And of course my 10 year old son Ludo.",within an hour,100%,100%,t,https://a0.muscache.com/im/pictures/user/3b01ee97-1f75-4cbd-a5ae-6755cef5fccb.jpg?aki_policy=profile_small,https://a0.muscache.com/im/pictures/user/3b01ee97-1f75-4cbd-a5ae-6755cef5fccb.jpg?aki_policy=profile_x_medium,Lipótváros,3,4,"['email', 'phone']",t,t,"Budapest, Hungary",V. kerület,,47.51061,19.05293,Entire rental unit,Entire home/apt,2,1.5,1.5 baths,1.0,1.0,"[""Shower gel"", ""Oven"", ""Hair dryer"", ""Microwave"", ""Private patio or balcony"", ""Cleaning products"", ""Heating"", ""Coffee maker"", ""Elevator"", ""Wifi"", ""Shampoo"", ""Hot water"", ""Dishwasher"", ""Free washer \u2013 In unit"", ""Central air conditioning"", ""Self check-in"", ""Refrigerator"", ""Pack \u2019n play/Travel crib"", ""Iron"", ""High chair"", ""Paid parking on premises"", ""Stove"", ""Hangers"", ""Dishes and silverware"", ""Kitchen"", ""Garden view"", ""Cooking basics"", ""TV"", ""Essentials"", ""Long term stays allowed"", ""Bed linens"", ""Lockbox""]","$30,435.00",3,90,3,3,90,90,3.0,90.0,,t,1,11,28,43,2025-05-25,313,25,2,43,24,150,4565250.0,2013-08-17,2025-05-11,4.94,4.96,4.91,4.97,4.98,4.85,4.88,EG19022903,f,1,1,0,0,2.18
